{"budget":{"final_sha256":"ff363e8072775acfbf43b3eb0ea2b16f7e4eb6da12b2f52fc8e4820cbbc85c9f","initial_sha256":"ff363e8072775acfbf43b3eb0ea2b16f7e4eb6da12b2f52fc8e4820cbbc85c9f","outcome":"completed"},"dependencies":[],"diagnostics":[],"evidence_id":"evidence_replay_mismatch","extensions":{},"format":{"canonicalization":"org.mathhead.canonical-json","features":[],"format_id":"org.mathhead.proof","kind":"proof","major":1,"minor":0,"reader_minimum_minor":0,"schema_sha256":"9069a32230a1f4d3851a27610dc11c7b095520aa5253801eaed14c134e22c049","version":"1.0.0"},"generation":{"algorithm_id":"org.mathhead.fixture.replay-mismatch","basis_sha256":"6d4ada390c1a3619620342fc8e81fbbd4c2c03b5a0a72d217cdd823d05509f00","configuration_sha256":"840e05350e0048be566b23028d81590605b88f70844e3e4a428b42d798ac3de8","input_sha256":"cb6e9dfc5dfc59ce1cc647cfad7952c1fdd7f9d36f890b56cc3c937f72cfc3be","mode":"deterministic","seed":null},"outcome":{"diagnostic_ids":[],"payload_ids":["payload_replay_mismatch"],"status":"produced"},"payloads":[{"byte_count":135,"compression":"none","encoding":"utf-8","extensions":{},"media_type":"application/json","payload_id":"payload_replay_mismatch","role":"primary","sha256":"7a9e0dbe7054133b28a8fc16d0a08c612fa5c6f6f26197de2ae5e5cc0567844f"}],"primary_payload_id":"payload_replay_mismatch","producer":{"component_id":"component_producer","configuration_sha256":"840e05350e0048be566b23028d81590605b88f70844e3e4a428b42d798ac3de8","contract_id":"MH-C-EXAMPLE-PRODUCER-001","contract_sha256":"05c4ce74dff8cd9af76d64a936f91450026266cedfaaedb44e8f2b5d98569141","environment_contract_sha256":"9a7b3269c4fbf66d12a5df2afd09d362d0746fcde26391c917c8cd172ca32506","implementation_sha256":"2664ea2ad38cb0501499c85eb6be26069aa09b7835e62a50a4f7b4fb24726f47","name":"org.mathhead.example-producer","role":"solver","version":"1.0.0"},"schema":"mathhead.evidence.v1","subject":{"assumption_sha256s":[],"kind":"goal","obligation_sha256s":[],"problem_ir_sha256":"367b2e835f815491ebd36e73975beadeb5a3ea27594e6aea0a7b536d8eedd43f","reading_id":"reading_only","statement_sha256":"4cf1ba2980979e412ddafd06bb221a80a899d8f245451bc75be04afa55ece236","subject_id":"goal_reflexive","theory_context_sha256":"66625fbb710bf17c0510101146081944975f6d76498c0789a7549c30713c9472"}}
